{
  "version": "2.0",
  "builtAt": "2026-06-23T02:21:27.004Z",
  "workspace": "workspace_fuel",
  "domain": "combustibles",
  "parent": "FL2-25105",
  "flowReadme": "README-combustibles.md",
  "summary": {
    "specs": 17,
    "byType": {
      "context": 5,
      "functional": 2,
      "technical": 10
    },
    "byRepo": {
      "(workspace)": 3,
      "backend-product-fuel-policy-enforcer": 10,
      "backend-customer-account-drivers": 2,
      "frontend-micro-fuel": 2
    },
    "byStatus": {
      "approved": 10,
      "implemented": 1,
      "draft": 6
    },
    "flows": [
      {
        "key": "b2c-supply-completed",
        "specs": 4
      },
      {
        "key": "b2c-supply-in-progress",
        "specs": 3
      },
      {
        "key": "b2b",
        "specs": 6
      }
    ],
    "specsWithoutFlow": [
      "SPEC-FL2-24307",
      "FPE-0003",
      "0008_SPEC_fpe_full_tank_per_station",
      "0001_SPEC_outbox_table"
    ],
    "edges": 37,
    "byEdgeType": {
      "refines": 3,
      "depends_on": 2,
      "shares_entity": 25,
      "shares_endpoint": 6,
      "shares_component": 1
    },
    "figmaStatus": {
      "missing": 2,
      "n/a": 13,
      "ok": 2
    },
    "specsWithFigmaIssues": [
      "CTX-COMBUSTIBLES",
      "MFE-0000"
    ],
    "withoutFrontMatter": [
      "0008_SPEC_fpe_full_tank_per_station",
      "0000_SPEC_project_context",
      "0001_SPEC_outbox_table"
    ],
    "warnings": [],
    "files": [
      "specs/0000_SPEC_contexto_dominio_combustibles.md",
      "specs/SPEC-FL2-24307-config-punto-atencion.md",
      "specs/SPEC-FL2-25105-cupo-diario-politica-combustible.md",
      "backend-product-fuel-policy-enforcer/specs/0000_SPEC_project_context.md",
      "backend-product-fuel-policy-enforcer/specs/0001_spec_fuel_dispenser_qr.md",
      "backend-product-fuel-policy-enforcer/specs/0002_spec_full_authorize_preauth_flow.md",
      "backend-product-fuel-policy-enforcer/specs/0003_spec_FL2_24307.md",
      "backend-product-fuel-policy-enforcer/specs/0004_spec_outbox_table.md",
      "backend-product-fuel-policy-enforcer/specs/0005_SPEC_hexagonal_modules.md",
      "backend-product-fuel-policy-enforcer/specs/0006_SPEC_fuel_transaction_report_table.md",
      "backend-product-fuel-policy-enforcer/specs/0007_SPEC_transaction_config_and_policy_daily_limit.md",
      "backend-product-fuel-policy-enforcer/specs/0008_SPEC_FL2_25105_cupo_diario.md",
      "backend-product-fuel-policy-enforcer/specs/0008_SPEC_fpe_full_tank_per_station.md",
      "backend-customer-account-drivers/specs/0000_SPEC_project_context.md",
      "backend-customer-account-drivers/specs/0001_SPEC_outbox_table.md",
      "frontend-micro-fuel/specs/0000_SPEC_project_context.md",
      "frontend-micro-fuel/specs/0001_SPEC_FL2_25105_politica_ui.md"
    ]
  },
  "contracts": [
    "specs/_api-drivers.md",
    "specs/_api-fuel-policy.md"
  ],
  "flows": [
    {
      "key": "b2c-supply-completed",
      "name": "Flujo B2C — suministro ya completado",
      "summary": "El usuario escanea el QR cuando el combustible ya fue despachado sin Flypass (hoseStatus SUPPLY_COMPLETED) y paga el valor exacto al final. FPE hace autorización completa (preautoriza y autoriza en un solo paso) vía POST /api/v1/full-fuel-authorizations (FullAuthorizeTransactionUseCase).",
      "states": "CREATED -> PREAUTHORIZED -> AUTHORIZED -> AUTHORIZED_PROVIDER_CONFIRMED",
      "entities": [
        "fuelTransaction",
        "fuelAuthorization",
        "fuelDispenser",
        "station"
      ],
      "notes": "El POS Distracom confirma por fallback con PUT /fuel-authorizations/confirm porque no hay preautorización pendiente sino autorización directa.",
      "definedIn": "CTX-COMBUSTIBLES",
      "specs": [
        "FPE-0001",
        "FPE-0002",
        "FPE-0004",
        "FPE-0006"
      ]
    },
    {
      "key": "b2c-supply-in-progress",
      "name": "Flujo B2C — suministro en proceso",
      "summary": "El usuario escanea el QR mientras se despacha (hoseStatus SUPPLY_ON_PROGRESS). Como el valor final no se conoce, FPE preautoriza (POST /fuel-transactions, CreateFuelTransactionUseCase) y el POS confirma y autoriza el pago real al terminar (PUT /fuel-transactions/confirm y PUT /fuel-authorizations).",
      "states": "CREATED -> PREAUTHORIZED -> PREAUTHORIZED_SENT_PROVIDER -> AUTHORIZED -> AUTHORIZED_PROVIDER_CONFIRMED",
      "entities": [
        "fuelTransaction",
        "fuelAuthorization",
        "fuelDispenser",
        "station"
      ],
      "notes": "La preautorización con validación por saldo insuficiente es un resultado válido en este flujo (responde 200 OK y continúa). El flujo de configuración antes del despacho (IDLE) comparte la misma mecánica.",
      "definedIn": "CTX-COMBUSTIBLES",
      "specs": [
        "FPE-0001",
        "FPE-0004",
        "FPE-0006"
      ]
    },
    {
      "key": "b2b",
      "name": "Flujo B2B — política por placa",
      "summary": "No inicia por QR de la app sino por el POS del proveedor (POST /fuel-authorizations, CreateFuelTransactionOnProcessUseCase). Está gobernado por una política de combustible (FuelPolicy) por placa, estación y cuenta/subcuenta, con autenticación PUSH_TOTP al conductor.",
      "states": "ON_PROCESS -> PREAUTHORIZED -> AUTHORIZED -> AUTHORIZED_PROVIDER_CONFIRMED",
      "entities": [
        "fuelPolicy",
        "plate",
        "driver",
        "fuelTransaction",
        "attentionPoint"
      ],
      "notes": "Relación con conductores — la política está asociada a una placa, y la placa está asociada a un conductor (repo backend-customer-account-drivers, PlateOwnerClientPort). El código TOTP se envía al conductor.",
      "definedIn": "CTX-COMBUSTIBLES",
      "specs": [
        "SPEC-FL2-25105",
        "FPE-0004",
        "FPE-0006",
        "FPE-0007",
        "FPE-0008",
        "MFE-0001"
      ]
    }
  ],
  "nodes": [
    {
      "id": "CTX-COMBUSTIBLES",
      "file": "specs/0000_SPEC_contexto_dominio_combustibles.md",
      "title": "Contexto de dominio combustibles — flujos B2C/B2B y relación con conductores",
      "type": "context",
      "status": "approved",
      "jira": null,
      "repo": null,
      "repos": [
        "backend-product-fuel-policy-enforcer",
        "backend-customer-account-drivers",
        "frontend-micro-fuel"
      ],
      "refines": [],
      "dependsOn": [],
      "flows": [],
      "flowDefinitions": [
        {
          "key": "b2c-supply-completed",
          "name": "Flujo B2C — suministro ya completado",
          "summary": "El usuario escanea el QR cuando el combustible ya fue despachado sin Flypass (hoseStatus SUPPLY_COMPLETED) y paga el valor exacto al final. FPE hace autorización completa (preautoriza y autoriza en un solo paso) vía POST /api/v1/full-fuel-authorizations (FullAuthorizeTransactionUseCase).",
          "states": "CREATED -> PREAUTHORIZED -> AUTHORIZED -> AUTHORIZED_PROVIDER_CONFIRMED",
          "entities": [
            "fuelTransaction",
            "fuelAuthorization",
            "fuelDispenser",
            "station"
          ],
          "notes": "El POS Distracom confirma por fallback con PUT /fuel-authorizations/confirm porque no hay preautorización pendiente sino autorización directa."
        },
        {
          "key": "b2c-supply-in-progress",
          "name": "Flujo B2C — suministro en proceso",
          "summary": "El usuario escanea el QR mientras se despacha (hoseStatus SUPPLY_ON_PROGRESS). Como el valor final no se conoce, FPE preautoriza (POST /fuel-transactions, CreateFuelTransactionUseCase) y el POS confirma y autoriza el pago real al terminar (PUT /fuel-transactions/confirm y PUT /fuel-authorizations).",
          "states": "CREATED -> PREAUTHORIZED -> PREAUTHORIZED_SENT_PROVIDER -> AUTHORIZED -> AUTHORIZED_PROVIDER_CONFIRMED",
          "entities": [
            "fuelTransaction",
            "fuelAuthorization",
            "fuelDispenser",
            "station"
          ],
          "notes": "La preautorización con validación por saldo insuficiente es un resultado válido en este flujo (responde 200 OK y continúa). El flujo de configuración antes del despacho (IDLE) comparte la misma mecánica."
        },
        {
          "key": "b2b",
          "name": "Flujo B2B — política por placa",
          "summary": "No inicia por QR de la app sino por el POS del proveedor (POST /fuel-authorizations, CreateFuelTransactionOnProcessUseCase). Está gobernado por una política de combustible (FuelPolicy) por placa, estación y cuenta/subcuenta, con autenticación PUSH_TOTP al conductor.",
          "states": "ON_PROCESS -> PREAUTHORIZED -> AUTHORIZED -> AUTHORIZED_PROVIDER_CONFIRMED",
          "entities": [
            "fuelPolicy",
            "plate",
            "driver",
            "fuelTransaction",
            "attentionPoint"
          ],
          "notes": "Relación con conductores — la política está asociada a una placa, y la placa está asociada a un conductor (repo backend-customer-account-drivers, PlateOwnerClientPort). El código TOTP se envía al conductor."
        }
      ],
      "entities": [
        "fuelPolicy",
        "outbox"
      ],
      "endpoints": [
        "GET /fuel-dispensers",
        "POST /api/v1/full-fuel-authorizations",
        "PUT /fuel-transactions/:confirm",
        "PUT /fuel-authorizations/:confirm",
        "POST /fuel-transactions",
        "PUT /fuel-authorizations",
        "POST /fuel-authorizations",
        "POST /fuel-authorizations/:approve",
        "GET /api/v1/plates/{licensePlate}/drivers/validate"
      ],
      "components": [],
      "conditions": [
        "kafka_event",
        "qr_flow",
        "daily_limit"
      ],
      "figmaUrls": [],
      "figmaStatus": "missing",
      "figmaWarnings": [
        "Spec con UI sin Figma URL. Pedir node-id a diseño antes de implementar (bloqueante UI)."
      ],
      "requiresUi": true,
      "acceptanceCount": 0,
      "hasFrontMatter": true
    },
    {